{
  "ambiguous_count": 1,
  "capture_files": [
    "correlation-ambiguous.pcap"
  ],
  "limitations": [
    "correlation is protocol-local and never asserts session, PDN-connection or bearer success",
    "a response is only paired with a request captured in the same file",
    "sequence numbers and TEIDs are not globally unique; endpoint scoping is mandatory"
  ],
  "matched_count": 0,
  "open_request_count": 0,
  "protocol": "GTPv2-C",
  "response_only_count": 0,
  "retransmission_count": 0,
  "transaction_count": 1,
  "transactions": [
    {
      "correlation_basis": [
        "same capture provenance",
        "request/response message identity",
        "reversed endpoint tuple",
        "equal sequence number"
      ],
      "correlation_status": "AMBIGUOUS",
      "correlation_strength": "NONE",
      "corroboration": {
        "decoder_link_frame": null,
        "teid_echo": null,
        "teid_relation": "initial_zero_teid_request"
      },
      "evidence_refs": [
        {
          "frame_number": 5,
          "header_teid": 0,
          "header_teid_state": "ZERO",
          "message_type": "Create Session Request",
          "message_type_code": 32,
          "sequence_number": 23
        }
      ],
      "limitations": [
        "several responses share the correlation keys; no response is selected",
        "the request carried header TEID 0; the TEID alone cannot identify the session"
      ],
      "message_family": "create-session",
      "observation_window": {
        "end_frame": 5,
        "start_frame": 5
      },
      "procedure_family": "create-session",
      "request": {
        "frame_number": 5,
        "header_teid": 0,
        "header_teid_state": "ZERO",
        "message_type": "Create Session Request",
        "message_type_code": 32,
        "sequence_number": 23
      },
      "response": null,
      "response_candidates": [
        {
          "frame_number": 8,
          "header_teid": 6,
          "header_teid_state": "PRESENT",
          "message_type": "Create Session Response",
          "message_type_code": 33,
          "sequence_number": 23
        },
        {
          "frame_number": 9,
          "header_teid": 6,
          "header_teid_state": "PRESENT",
          "message_type": "Create Session Response",
          "message_type_code": 33,
          "sequence_number": 23
        }
      ],
      "retransmissions": [],
      "transaction_reference": "gtpv2-create-session-5-23"
    }
  ]
}
