{
  "ambiguous_count": 0,
  "capture_files": [
    "correlation-endpoints.pcap"
  ],
  "limitations": [
    "correlation is protocol-local and never asserts session, PDN-connection or bearer success",
    "a response is only paired with a request captured in the same file",
    "sequence numbers and TEIDs are not globally unique; endpoint scoping is mandatory"
  ],
  "matched_count": 2,
  "open_request_count": 0,
  "protocol": "GTPv2-C",
  "response_only_count": 0,
  "retransmission_count": 0,
  "transaction_count": 2,
  "transactions": [
    {
      "correlation_basis": [
        "same capture provenance",
        "request/response message identity",
        "reversed endpoint tuple",
        "equal sequence number"
      ],
      "correlation_status": "MATCHED",
      "correlation_strength": "SUPPORTED",
      "corroboration": {
        "decoder_link_frame": null,
        "teid_echo": null,
        "teid_relation": "initial_zero_teid_request"
      },
      "evidence_refs": [
        {
          "frame_number": 10,
          "header_teid": 0,
          "header_teid_state": "ZERO",
          "message_type": "Create Session Request",
          "message_type_code": 32,
          "sequence_number": 5
        },
        {
          "frame_number": 11,
          "header_teid": 7,
          "header_teid_state": "PRESENT",
          "message_type": "Create Session Response",
          "message_type_code": 33,
          "sequence_number": 5
        }
      ],
      "limitations": [
        "the request carried header TEID 0; the TEID alone cannot identify the session"
      ],
      "message_family": "create-session",
      "observation_window": {
        "end_frame": 11,
        "start_frame": 10
      },
      "procedure_family": "create-session",
      "request": {
        "frame_number": 10,
        "header_teid": 0,
        "header_teid_state": "ZERO",
        "message_type": "Create Session Request",
        "message_type_code": 32,
        "sequence_number": 5
      },
      "response": {
        "frame_number": 11,
        "header_teid": 7,
        "header_teid_state": "PRESENT",
        "message_type": "Create Session Response",
        "message_type_code": 33,
        "sequence_number": 5
      },
      "response_candidates": [
        {
          "frame_number": 11,
          "header_teid": 7,
          "header_teid_state": "PRESENT",
          "message_type": "Create Session Response",
          "message_type_code": 33,
          "sequence_number": 5
        }
      ],
      "retransmissions": [],
      "transaction_reference": "gtpv2-create-session-10-5"
    },
    {
      "correlation_basis": [
        "same capture provenance",
        "request/response message identity",
        "reversed endpoint tuple",
        "equal sequence number"
      ],
      "correlation_status": "MATCHED",
      "correlation_strength": "SUPPORTED",
      "corroboration": {
        "decoder_link_frame": null,
        "teid_echo": null,
        "teid_relation": "initial_zero_teid_request"
      },
      "evidence_refs": [
        {
          "frame_number": 12,
          "header_teid": 0,
          "header_teid_state": "ZERO",
          "message_type": "Create Session Request",
          "message_type_code": 32,
          "sequence_number": 5
        },
        {
          "frame_number": 13,
          "header_teid": 9,
          "header_teid_state": "PRESENT",
          "message_type": "Create Session Response",
          "message_type_code": 33,
          "sequence_number": 5
        }
      ],
      "limitations": [
        "the request carried header TEID 0; the TEID alone cannot identify the session"
      ],
      "message_family": "create-session",
      "observation_window": {
        "end_frame": 13,
        "start_frame": 12
      },
      "procedure_family": "create-session",
      "request": {
        "frame_number": 12,
        "header_teid": 0,
        "header_teid_state": "ZERO",
        "message_type": "Create Session Request",
        "message_type_code": 32,
        "sequence_number": 5
      },
      "response": {
        "frame_number": 13,
        "header_teid": 9,
        "header_teid_state": "PRESENT",
        "message_type": "Create Session Response",
        "message_type_code": 33,
        "sequence_number": 5
      },
      "response_candidates": [
        {
          "frame_number": 13,
          "header_teid": 9,
          "header_teid_state": "PRESENT",
          "message_type": "Create Session Response",
          "message_type_code": 33,
          "sequence_number": 5
        }
      ],
      "retransmissions": [],
      "transaction_reference": "gtpv2-create-session-12-5"
    }
  ]
}
